3866,mentalidade,mentality,o treinador desenvolveu nele a mentalidade de um campeão.,– The coach instilled in him the mentality of a champion.,[sound:mentalidade.ogg],
3867,terrorista,terrorist,os EUA bombardearam importantes campos de treino de terroristas islâmicos.,– The US bombed important camps that trained Islamic terrorists.,[sound:terrorista.ogg],
3868,perturbação,"disturbance, commotion","as perturbações mentais sofridas por ele foram se agravando, culminando no suicídi.","– The mental disturbances from which he suffered became progressively worse, leading to suicide.",[sound:perturbação.ogg],
3869,lote,lot,os lavradores começavam a dividiras suas terras em pequenos lotes.,– The farmers began to divide their land into small lots.,[sound:lote.ogg],
3870,bem-estar,well-being,o bem-estar económico foi provocado pela venda do petróleo.,– Economic well-being was brought about by the sale of oil.,[sound:bem-estar.ogg],
3871,cruel,cruel,fui vítima de mentiras cruéis.,– I was the victim of cruel lies.,[sound:cruel.ogg],
3872,rondar,"to be approximately, circle",o orçamento total da obra ronda os 20 mil contos.,– The total budget for the work is about 20 million escudos.,[sound:rondar.ogg],
3873,reclamação,"complaint, grievance",o Senado deve aprovar o projeto mas as reclamações são muitas.,– The Senate should approve the project but there are many complaints.,[sound:reclamação.ogg],
3874,infeliz,unhappy,a falta dela fazia-o infeliz.,– Her absence made him unhappy.,[sound:infeliz.ogg],
3875,ténis,"tennis, tennis shoes",ele estava jogando ténis com ela nas quadras do clube.,– He was playing tennis with her in the courts of the club.,[sound:ténis.ogg],pt-pt
3876,tênis,"tennis, tennis shoes",ele estava jogando tênis com ela nas quadras do clube.,– He was playing tennis with her in the courts of the club.,[sound:tênis.ogg],pt-br
3877,manso,"meek, tame, gentle",é um animal manso e pode ser domesticad.,– It is a tame animal and it can be domesticated.,[sound:manso.ogg],
3878,confuso,"confused, confusing",a pessoa senil fica confusa e padecede esquecimentos.,– Senile people become confused and suffer from,[sound:confuso.ogg],
3879,oposto,"opposite, opposing",os dois já estiveram em lados opostos da guerra.,– Both have already been on opposite sides of the war.,[sound:oposto.ogg],
3880,degrau,step,ele acabou de subir os últimos degraus; chegou à porta do salão.,– He finished climbing the last few steps; he arrived at the ballroom door.,[sound:degrau.ogg],
3881,camisola,"nightgown [BP], sweater [EP]",a barriga enorme esticava-lhe a camisola de algodão ralo.,– Her enormous belly stretched her thin cotton nightgown.,[sound:camisola.ogg],
3882,magnético,magnetic,daqui a 1.200 anos o pólo norte magnético será no sul.,"– 1200 years from now, the magnetic North pole will be in the south.",[sound:magnético.ogg],
3883,hectare,hectare,na Bulgária cerca de 58 mil hectares de florestas foram varridos pela chamas.,"– In Bulgaria, around 58 thousand hectares of forest were swept away by the flames.",[sound:hectare.ogg],
3884,beijo,kiss,o beijo mais íntimo é o chamado beijo francês.,– The most intimate of kisses is the so-called French kiss.,[sound:beijo.ogg],
3885,reformar,to reform,as suas tentativas de reformar o clero ganharam o apoio popular.,– His attempts to reform the clergy gained popular support.,[sound:reformar.ogg],
3886,revoltar,"to revolt, disgust","a etnia turca revoltou-se contra a população grega, retirando-se do governo.","– The ethnic Turks revolted against the Greek population, withdrawing from the government.",[sound:revoltar.ogg],
3887,ascender,"to go up, ascend",os pobres podem ascender na escada social através da educação nas boas escolas.,– The poor can go up the social ladder by being educated in good schools.,[sound:ascender.ogg],
3888,interlocutor,"spokesperson, speaker",tornou-se um importante interlocutor nas relações entre brancos e negros nos EUA.,– He became an important spokesperson in negotiations between blacks and whites in the US.,[sound:interlocutor.ogg],
3889,centrar,"to center, focus",o símbolo visual centrava-se na área designada por locus.,– The visual symbol was centered in the area designated as the locus.,[sound:centrar.ogg],
3890,mobilizar,to mobilize,a esquadra portuguesa foi mobilizada.,– The Portuguese squadron was mobilized.,[sound:mobilizar.ogg],
3891,incerteza,uncertainty,a incerteza e o risco sempre foram inseparáveis do erro.,– Uncertainty and risk have always been inseparable from error.,[sound:incerteza.ogg],
3892,testamento,"will, testament","esses retratos, ele havia de os deixar, em testamento, aos amigos.",– He was going to leave those portraits to his friends in his will.,[sound:testamento.ogg],
3893,feroz,"fierce, ferocious",seguiu-se uma feroz perseguição a todos os que veneravam ícones.,– A fierce persecution ensued for all those who worshipped idols.,[sound:feroz.ogg],
3894,comercialização,"marketing, commercialization",o mercado da arte favoreceu a comercialização das obras.,– The art market favored the marketing of the works.,[sound:comercialização.ogg],
3895,despejar,"to pour, evict",ela apanhou um copo e despejou um gole na boca.,– She took a cup and poured a big gulp into her mouth.,[sound:despejar.ogg],
3896,encosta,"slope, hillside",as águas desceram pelas encostas das montanhas.,– The waters flowed down the sides of the mountain.,[sound:encosta.ogg],
3897,aprendizagem,learning,os golfinhos têm grande capacidade de aprendizagem.,– Dolphins are capable of a great deal of learning.,[sound:aprendizagem.ogg],
3898,aproveitamento,act of taking advantage,o aproveitamento das oportunidades era um ponto capital em negócios.,– Taking advantage of opportunities used to be a critical aspect of business.,[sound:aproveitamento.ogg],
3899,escritura,"scriptures, legal document","segundo a crença, as escrituras religiosas deverão ter sido fruto de inspiração.","– According to belief, religious scriptures must have been the fruit of inspiration.",[sound:escritura.ogg],
3900,pancada,"blow, hit",o lutador fora deitar-se com o corpo moído de pancadas.,"– The fighter went to lie down, his body tired out by the blows.",[sound:pancada.ogg],
3901,cansaço,"fatigue, exhaustion","fui fechando os olhos, vencido pelo cansaço, e acabei por dormir.","– My eyes slowly closed as I was overtaken by fatigue, and I ended up falling asleep.",[sound:cansaço.ogg],
3902,racional,rational,os animais não são seres racionais.,–Animals are not rational beings.,[sound:racional.ogg],
3903,virtual,virtual,a realidade virtual é uma simulação em computador.,– Virtual reality is a computer simulation.,[sound:virtual.ogg],
3904,disciplinar,to discipline,o relator vai sugerir regras mais rigorosas para os disciplinar.,– The representative will suggest more rigorous rules to discipline them.,[sound:disciplinar.ogg],
3905,fornecimento,"supply, furnishing",o fornecimento de água à cidade for feito através do aqueduto durante vários século.,– The supply of water to the city was furnished by an aqueduct for several centuries.,[sound:fornecimento.ogg],
3906,monarquia,monarchy,a monarquia foi abolida em 1946 e proclamada a república.,– The monarchy was abolished in 1946 and a Republic was declared.,[sound:monarquia.ogg],
3907,esforçar,"to strive, try hard",Gandhi esforçou-se para apaziguar os distúrbios inter-religiosos.,– Gandhi strove to pacify inter-religious disputes.,[sound:esforçar.ogg],
3908,repartição,"office, distribution",um bocejo ecoou pela repartição e foi acordar todos os empregados.,– A yawn echoed through the office and woke up the employees.,[sound:repartição.ogg],
3909,indireto,indirect,os efeitos indiretos do não cumprimento desta lei recaem diretamente sobre a população.,– The indirect consequences of not obeying this law directly affect the population.,[sound:indireto.ogg],
3910,caraterístico,characteristic (feature),as flores têm um odor agradável característico.,– Flowers have a pleasing characteristic odor.,[sound:caraterístico.ogg],
3911,quinta-feira,Thursday,a viagem do governador está previstapara quarta ou quinta-feira.,– The governor’s trip is planned for Wednesday or,[sound:quinta-feira.ogg],
3912,fraude,fraud,"os oposicionistas denunciaram fraudes eleitorais e, em setembro, organizaram protestos.","– The opposition claimed there had been electoral fraud and, in September, organized protests.",[sound:fraude.ogg],
3913,especificamente,specifically,alguns sistemas operativos foramescritos especificamente para determinados computadores.,– Some operating systems were specifically written for certain computers.,[sound:especificamente.ogg],
3914,júri,jury,o júri tomou a decisão por unanimidade.,– The jury made the decision unanimously.,[sound:júri.ogg],
3915,sétimo,seventh,por isto repousamos no sétimo dia.,"– For this reason, we rest on the seventh day.",[sound:sétimo.ogg],
3916,cela,cell (building),o denunciante está preso numa cela de segurança máxima.,– The whistle blower is incarcerated in a maximum security cell.,[sound:cela.ogg],
3917,pousar,"to land, rest",o avião não conseguiu pousar por causa da forte neblina.,– The plane wasn’t able to land because of the heavy fog.,[sound:pousar.ogg],
3918,sanção,sanction,"eles exigiram, ainda, o fim imediato das sanções impostas ao Iraque.","– In addition, they demanded an immediate end to the sanctions placed on Iraq.",[sound:sanção.ogg],
3919,empenho,"dedication, effort, focus",suplicaram-lhe empenho e rapidez no andamento do inventário.,– They requested dedication and speed in the preparation of the inventory.,[sound:empenho.ogg],
3920,afastado,"cut off, removed, distanced",o excomungado fica afastado da participação nos ritos e sacramento.,– The excommunicated remain cut off from participation in rites and sacraments.,[sound:afastado.ogg],
3921,decoração,"decoration, embellishment",a decoração das louças apresenta flores e pássaros pintados a vermelho.,– The decorations on the dishes include flowers and birds painted in red.,[sound:decoração.ogg],
3922,ponderar,to ponder,"eu estava absorto em meus pensamentos, ponderando todas as possibilidades.","– I was absorbed in my thoughts, pondering all of the possibilities.",[sound:ponderar.ogg],
3923,fogueira,bonfire,a lenha estalava na fogueira.,– The wood crackled in the bonfire.,[sound:fogueira.ogg],
3924,exceder,to exceed,"a produção no Brasil, neste período, excedia muito o consumo mundial tota.","– The production in Brazil, during this period, greatly exceeded total worldwide consumption.",[sound:exceder.ogg],
3925,mentir,to lie,tive de mentir e de inventar que estávamos de passagem.,– I had to lie and pretend that we were just passing through.,[sound:mentir.ogg],
3926,polémica,controversy [EP],a investigação destas células estaminais acarreta uma enorme polémica [EP].,– Stem cell research is surrounded by an enormous controversy.,[sound:polémica.ogg],pt-pt
3927,polêmica,controversy,a investigação destas células estaminais acarreta uma enorme polémica.,– Stem cell research is surrounded by an enormous controversy.,[sound:polêmica.ogg],pt-br
3928,acessível,accessible,os livros só se tornaram mais acessíveis depois da invenção da impressão.,– Books only became more accessible after the invention of the printing press.,[sound:acessível.ogg],
3929,confrontar,to confront,as tropas governamentais e os rebeldes confrontaram-se.,– The government troops and the rebels confronted each other.,[sound:confrontar.ogg],
3930,secretário-geral,secretary-general,o secretário-geral do Partido Comunista era Zhao Ziyang.,– The secretary-general of the Communist Party was Zhao Ziyang.,[sound:secretário-geral.ogg],
3931,requisito,"requirement, requisite",a simpatia e o profissionalismo são requisitos cada vez mais necessários.,– Friendliness and professionalism are requirements that are becoming ever more necessary.,[sound:requisito.ogg],
3932,valorização,appreciation (in value),"essa situação contribuiu para a valorização de 0,1% do índice.",– This situation contributed to the appreciation of 0.1 percent of the index.,[sound:valorização.ogg],
3933,litro,liter,o coração bombeia seis litros de sangue por minuto.,– The heart pumps six liters of blood per minute.,[sound:litro.ogg],
3934,criativo,creative,o trabalho do artista é realmente criativo e inovador.,– The artist’s work is truly creative and innovative.,[sound:criativo.ogg],
3935,constituinte,"constituent, part of, member",É um mineral constituinte de várias rocha.,– It is constituent mineral of various rocks.,[sound:constituinte.ogg],
3936,silencioso,silent,"Verônica permanecera imperturbável e silenciosa, fechada como um túmulo.","– Veronica remained inaccessible and silent, shut off like a tomb.",[sound:silencioso.ogg],
3937,salarial,relating to salary,os manifestantes em greve há 27 dias reivindicam 27% de aumento salarial.,"– The demonstrators, who have been on strike for 27 days, are demanding a 27% salary increase",[sound:salarial.ogg],
3938,adjunto,"assistant, adjunct","passados dois meses da derrota, viria a ser nomeado adjunto do governador.","– Two months after the defeat, he would be named assistant to the governor.",[sound:adjunto.ogg],
3939,caridade,charity,"se não fosse a caridade das pessoasdas aldeias próximas, morreria à fome.","–If it weren’t for the charity of people from nearby villages, he would die of hunger.",[sound:caridade.ogg],
3940,carência,"lack of, need",a carência de habitações adequadas constitui um dos problemas mais graves da sociedade brasileira.,– The lack of adequate housing is one of the most serious problems in Brazilian society.,[sound:carência.ogg],
3941,grávida,pregnant,depois eu casei-me; fiquei logo grávid.,– Later I got married; I soon became pregnant.,[sound:grávida.ogg],
3942,sofisticado,sophisticated,a audição utiliza um sofisticado receptor: a orelha humana.,– Hearing uses a sophisticated receiver: the human ear.,[sound:sofisticado.ogg],
3943,mobiliário,furniture,entrei na sala espaçosa de mobiliário antig.,– I went into the spacious room with antique furniture.,[sound:mobiliário.ogg],
3944,repetição,repetition,não seria mais do que a repetição do que já me tem ouvido.,– It wouldn’t be any more than a repetition of what you’ve already been hearing me say.,[sound:repetição.ogg],
3945,discípulo,disciple,a seus discípulos disse Cristo que ficassem no seu amor.,– Christ told his disciples to remain in his love.,[sound:discípulo.ogg],
3946,trezentos,three hundred,a velocidade do veículo pode ultrapassar 300 quilômetros por hora.,– This vehicle’s speed can exceed three hundred kilometers per hour.,[sound:trezentos.ogg],
3947,pianista,pianist,"acho que o pianista, antes de ser músico, é um artista.",– I think that pianists are first and foremost artists and then musicians.,[sound:pianista.ogg],
3948,alastrar,to spread,uma senhora muito gorda se alastrava pela cama.,– An obese woman lay spread across the bed.,[sound:alastrar.ogg],
3949,restaurar,to restore,os transplantes de córnea podem restaurar a visão de um olho doente.,– Cornea transplants can restore vision to an unhealthy eye.,[sound:restaurar.ogg],
3950,teia,web (spider),a matéria da teia da aranha é tão resistente como o aço.,– The material that makes up a spider web is as resistant as steel.,[sound:teia.ogg],
3951,cova,"opening, cave, hole","o índio foi enterrado esquartejado, de cabeça para baixo, dentro de uma cova.","– The Indian was buried all cut up, upside down, inside a hole.",[sound:cova.ogg],
3952,tarifa,tariff,a tarifa média de importação era de 54%.,–The average import tariff was 54%.,[sound:tarifa.ogg],
3953,carregado,"loaded with, carried",o instituto apreendeu 40 caminhões carregados de madeiras em Rondônia.,"– In Rondonia, the institute apprehended 40 trucks loaded with wood.",[sound:carregado.ogg],
3954,decretar,to decree,o governo decretou o estado de calamidade em algumas regiões.,– The government decreed a state of emergency in some regions.,[sound:decretar.ogg],
3955,intuição,intuition,os sufis acreditam que a profunda intuição é o único guia verdadeiro.,– Sufis believe that deep intuition is the only true guide.,[sound:intuição.ogg],
3956,imigrante,immigrant,grandes fluxos de imigrantes italianos tiveram entrada no Brasil.,– Large groups of Italian immigrants entered Brazil.,[sound:imigrante.ogg],
3957,ditar,to dictate,o sistema de leis islâmico é ditado pelo Alcorão.,– The system of Islamic law is dictated by the Koran.,[sound:ditar.ogg],
3958,infeção,infection,não há cura definitiva para a infecção por filovírus.,– There is no definitive cure for a filovirus infection.,[sound:infeção.ogg],
3959,sabedoria,wisdom,colhíamos dos velhos a sua sabedoria e o seu conselho.,– From the elderly we received their wisdom and counsel.,[sound:sabedoria.ogg],
3960,pioneiro,"pioneer, pioneering",Ernest Rutherford foi pioneiro na moderna física atómica.,– Ernest Rutherford was a pioneer of modern atomic physics.,[sound:pioneiro.ogg],
3961,banhar,to bathe,"quando terminaram, foram até a lagoa se banhar.","– When they finished, they went to the lake to take a bath.",[sound:banhar.ogg],
3962,tremendo,tremendous,o desquite provocaria um escândalo tremendo. Prejudicaria a todos.,– The separation would cause a tremendous scandal. It would hurt everyone.,[sound:tremendo.ogg],
3963,aparição,"apparition, appearance","pareceu-lhe uma aparição, um sonho, uma miragem.","– It looked to him like an apparition, a dream, a vision.",[sound:aparição.ogg],
3964,devagar,"slowly, slow","desdobrei-o devagar, cada movimento uma eternidade.","– I unfolded it slowly, each movement lasting an eternity.",[sound:devagar.ogg],
3965,libra,pound,aquilo custou-me 15 libras.,– That cost me fifteen pounds.,[sound:libra.ogg],
3966,acalmar,"to calm down, appease","José, interpretando seu silêncio como nervosismo, procurou acalmá-la.","– José, interpreting her silence as nervousness, sought to calm her down.",[sound:acalmar.ogg],
3967,esclarecimento,"clarification, explanation",precisamos de mais esclarecimentos sobre o que a prefeitura espera do nosso gabinete.,– We need more clarification concerning what the mayor expects from our office.,[sound:esclarecimento.ogg],
3968,proveito,"profit, taking advantage",as árvores são de grande proveito econômico.,– Trees are a source of great economic profit.,[sound:proveito.ogg],
3969,comemoração,commemoration,o acontecimento marca a comemoração dos 500 anos da cidade.,– The event marks the commemoration of the city’s 500th anniversary.,[sound:comemoração.ogg],
3970,desembarcar,"to get out, disembark",o motorista abriu a porta para que o banqueiro desembarcasse.,– The motorist opened the door so the banker could get out.,[sound:desembarcar.ogg],
3971,adeus,"goodbye, farewell, adieu","nunca mais nos veremos. Adeus, adeus.","– We’ll never see each other again. Goodbye, farewell.",[sound:adeus.ogg],
3972,massacre,massacre,o objetivo é relembrar o massacre dos judeus pelos nazistas.,– The main objective is to memorialize the massacre of the Jews by the Nazis.,[sound:massacre.ogg],
3973,retratar,to portray,as suas caricaturas retratam professores universitários.,– His caricatures portray university professors.,[sound:retratar.ogg],
3974,injusto,"unjust, unfair",ele considera injustas as críticas e acusações levantadas.,– He considered unjust the criticisms and accusations leveled against him.,[sound:injusto.ogg],
3975,limitado,limited,a minha poesia é limitada do ponto de vista musical.,– My poetry is limited from a musical point of view.,[sound:limitado.ogg],
3976,tributário,"related to taxes, tributary",os empresários querem que o atual regime tributário seja substituído.,– The business owners want the current tax code to be reviewed.,[sound:tributário.ogg],
3977,florestal,relating to the forest,os macacos que vivem nas regiões florestais das Américas são bastante diversos.,– The monkeys that live in the forest regions of the Americas are very diverse.,[sound:florestal.ogg],
3978,sociologia,sociology,a sociologia analisa instituições como a família e a igreja.,– Sociology studies institutions such as the family and the church.,[sound:sociologia.ogg],
3979,fidelidade,"loyalty, faithfulness, fidelity",eram precisamente a sua solidez e a sua fidelidade que davam ao povo a ideia de segurança.,– It was precisely because of his steadfastness and loyalty that the people felt secure.,[sound:fidelidade.ogg],
3980,contraditório,contradictory,as proposições que não podem ser ambas verdadeiras e ambas falsas são contraditória.,– Propositions that can’t be both true and false are contradictory.,[sound:contraditório.ogg],
3981,mineral,mineral,trata-se de uma fonte de água mineral pura.,– It is a source of pure mineral water.,[sound:mineral.ogg],
3982,partícula,particle,o fotão exibe características tanto de partícula como de onda.,– Photons exhibit both particle and wave characteristics.,[sound:partícula.ogg],
3983,auxiliar,"to help, aid",a luz do Sol auxilia as plantas na produção de nutrientes.,– The light of the Sun helps plants to produce nutrients.,[sound:auxiliar.ogg],
3984,estoque,stock [BP],o estoque das concessionárias está quase todo vendido [BP].,– The vendors’ stock has almost run out.,[sound:estoque.ogg],
3985,probabilidade,probability,é importante diminuir a probabilidade de erro e aumentar a precisão.,– It is important to reduce the probability of error and increase exactness.,[sound:probabilidade.ogg],
3986,gol,soccer goal [BP],o atacante Romário fez o gol brasileiro no primeiro tempo.,"– Romario, the attacker, made the goal for Brazil during the first period.",[sound:gol.ogg],
3987,coral,"coral, choral",no passeio de barco se pode ver indescritíveis recifes de corais.,– On the boat trip you can see indescribable coral reefs.,[sound:coral.ogg],
3988,contratar,to contract,no início ter-se-iam que contratar músicos estrangeiros e portugueses para os concerto.,– In the beginning they would have to contract foreign and Portuguese musicians for the concerts.,[sound:contratar.ogg],
3989,cambial,related to exchange rates,"o governo tem um problema cambial que pode matar o real a curto prazo, disse o economista.","– The Government has an exchange rate problem that could devalue the real in the short term, the economist said.",[sound:cambial.ogg],
3990,coxa,thigh,"na região da coxa, há muitas veias pequena.","– In the thigh area, there are many small veins.",[sound:coxa.ogg],
3991,progressivo,progressive,"faz-se dentro de parâmetros bem definidos, permitindo o evoluir constante e progressiv.","– It is done within defined parameters, allowing for constant and progressive evolution.",[sound:progressivo.ogg],
3992,reivindicar,"to demand, ask for",os sindicados se unem para reivindicar melhores salários.,– The trade unions came together to demand better salaries.,[sound:reivindicar.ogg],
3993,narrar,to narrate,o enredo central do romance narra a história do novo amor dele.,– The central plot of the novel narrates the story of his new love.,[sound:narrar.ogg],
3994,obtenção,"getting, obtaining",a melhor fonte para a obtenção do cálcio é o espinafre.,– The best source for getting calcium is spinach.,[sound:obtenção.ogg],
3995,eh,hey,"eh rapaz, dá-me aí fogo.","– Hey kid, give me a light.",[sound:eh.ogg],
3996,península,peninsula,a Península Ibérica foi invadida pelos bárbaros.,– The Iberian Peninsula was invaded by barbarians.,[sound:península.ogg],
3997,atualidade,"the present, modern times",os maiores produtores mundiais da actualidade são os EUA e a Rússia.,– The largest world producers at present are the USA and Russia.,[sound:atualidade.ogg],
3998,vibração,vibration,sentimos as vibrações produzidas pelas explosões.,– We felt the vibrations produced by the explosions.,[sound:vibração.ogg],
3999,fabrico,production [EP],o plutónio daria para o fabrico de quatro ou cinco engenhos nucleares. [EP].,– The plutonium will be sufficient for the production of four or five nuclear engines.,[sound:fabrico.ogg],
4000,moderado,moderate,a ambição é o que separa os moderados dos extremistas dentro de cada campo.,– Ambition is what separates moderates from extremists inside each camp.,[sound:moderado.ogg],
4001,esportivo,"sporting, sport [BP]",o evento esportivo da primeira olimpíada consistia simplesmente de uma corrida.,– The sporting event of the first Olympic Games consisted simply of a race.,[sound:esportivo.ogg],
4002,ênfase,emphasis,damos uma ênfase ainda maior à prevençã.,– We place an even bigger emphasis on prevention.,[sound:ênfase.ogg],
4003,contabilidade,"bookkeeping, accounting",estes registos constituem a base da contabilidade de qualquer entidade empresarial.,– The bookkeeping of any business entity is based on these records.,[sound:contabilidade.ogg],
4004,cerebral,"cerebral, of the brain","vítima de tumor cerebral, ele faleceu ontem em Porto Alegre.","– Victim of a brain tumor, he passed away yesterday in Porto Alegre.",[sound:cerebral.ogg],
4005,marinheiro,"sailor, seaman","em tempo de nevoeiro, o velho marinheiro leva o barco devagar.","– In foggy weather, the old sailor takes the boat slowly along.",[sound:marinheiro.ogg],
4006,publicamente,publicly,o congresso divulgou publicamente o relatório.,– Congress made the report available publicly.,[sound:publicamente.ogg],
