1254,especialmente,especially,"eu gosto de ler, especialmente Graciliano Ramos.","– I like to read, especially Graciliano Ramos.",[sound:especialmente.ogg],
1255,senão,"or else, except, if not","dá-lhe água, senão, ele morre.","– Give him water, or else, he’ll die.",[sound:senão.ogg],
1256,cultural,cultural,"ao nível cultural, a literatura e a arte floresceram.","– On a cultural level, literature and art flourished.",[sound:cultural.ogg],
1257,elevado,"high, elevated",o colesterol elevado no sangue pode ser controlado pela medicina.,– High cholesterol in the blood can be medically controlled.,[sound:elevado.ogg],
1258,chamada,phone call,o principal método de chamadas a longa distância era a transmissão de rádio.,– The main method of long distance phone calls was by radio transmission.,[sound:chamada.ogg],
1259,violento,violent,a guerrilha lançou uma violenta campanh.,– The guerilla began a violent campaign.,[sound:violento.ogg],
1260,disposição,"willingness, disposition",ele tinha disposição para ajudar.,– He was willing to help.,[sound:disposição.ogg],
1261,análise,analysis,vou precisar fazer uma análise da situação no que se refere a leis.,– I will need to make an analysis of the situation with reference to the law.,[sound:análise.ogg],
1262,pão,bread,a farinha deste cereal é usada para fazer o pão.,– The flour from this grain is used to make bread.,[sound:pão.ogg],
1263,anormal,"unusual, abnormal",tudo aquilo era tão anormal que só fez aumentar a curiosidade dele.,– All of that was so unusual that it made him even more curious.,[sound:anormal.ogg],
1264,amplo,"ample, broad","com ampla maioria no Congresso, ele perdeu importantes batalhas legislativas.","– With an ample majority in Congress, he lost important legislative battles.",[sound:amplo.ogg],
1265,confirmar,to confirm,"ele apalpou-lhe a testa, para confirmar a temperatura elevada.",– He touched his forehead to confirm that he had a high temperature.,[sound:confirmar.ogg],
1266,perigoso,dangerous,o tubarão é muito perigoso.,– Sharks are very dangerous.,[sound:perigoso.ogg],
1267,milhar,a thousand,este canal permite o transporte de milhares de toneladas por ano.,– This canal allows for the transport of thousands of tons each year.,[sound:milhar.ogg],
1268,pintar,to paint,o artista estava a pintar um quadro estupendo!,– The artist was painting an amazing work of art!,[sound:pintar.ogg],
1269,cometer,to commit (an act),fui preso em 1970 porque cometi um erro básico nas regras.,"– I was imprisoned in 1970 because, according to the rules, I committed a basic error.",[sound:cometer.ogg],
1270,apto,"capable, apt",o juiz escolherá entre eles o mais apto a exercer a tutela.,"– The judge will choose from among them, the one most capable of guardianship.",[sound:apto.ogg],
1271,crédito,credit,alguns cartões de crédito funcionam também como cartões de débito.,– Some credit cards also work as debit cards.,[sound:crédito.ogg],
1272,enfim,"in the end, finally, in short",o herói enfim logrará alcançar a imortalidade.,"– The hero, in the end, will achieve immortality.",[sound:enfim.ogg],
1273,suceder,"to happen, come next","tinha a impressão de que, naquela noite, podia suceder uma tragédia.","– I had the impression that, that night, a tragedy might happen.",[sound:suceder.ogg],
1274,normalmente,"normally, as normal","após esse incidente, o vôo decorreu normalmente.","– After that incident, the flight continued as normal.",[sound:normalmente.ogg],
1275,ca,here,vim para cá porque não consegui ganhar dinheiro na minha terra.,– I came here because I couldn’t make a living where I’m from.,[sound:ca.ogg],
1276,abertura,opening,o ar é forçado a entrar por aberturas na parte inferior desse tubo.,– The air is forced to enter through the openings on the bottom side of that tube.,[sound:abertura.ogg],
1277,extremo,extreme,é sempre perigoso pensar ou agir em termos extremos.,– It is always dangerous to think or act in terms of extremes.,[sound:extremo.ogg],
1278,desafio,challenge,ela aceitou o desafi que foi um acto de coragem por si mesmo.,"– He accepted the challenge, which was an act of courage in itself.",[sound:desafio.ogg],
1279,gastar,"to spend, waste",a empresa gastou 5 milhões de dólares só em computadores.,– The company spent $5 million dollars just on computers.,[sound:gastar.ogg],
1280,decorrer,"to happen as a result of, elapse (time)",a Independência do Brasil decorreu de um longo processo de decadência do sistema colonial.,– The Independence of Brazil happened as a result of the long process of decadence in the colonial system.,[sound:decorrer.ogg],
1281,essencial,essential,a água é um elemento essencial da vida.,–Water is an essential element of life.,[sound:essencial.ogg],
1282,ajustar,to adjust,"em seguida, o computador emite instruções para ajustar automaticamente as regulagens das máquinas.","– Next, the computer issues instructions to automatically adjust the machine’s functions.",[sound:ajustar.ogg],
1283,poema,poem,produziu-se uma literatura constituída de poemas épicos e sagas.,– They produced literature made up of epic poems and sagas.,[sound:poema.ogg],
1284,exercício,exercise,os exercícios aeróbicos fortalecem o músculo cardíaco.,– Aerobic exercises strengthen cardiac muscles.,[sound:exercício.ogg],
1285,barro,"clay, mud","o homem veio do barro, a mulher veio da costela.",– Man came from clay; the woman came from his rib.,[sound:barro.ogg],
1286,mundial,"world, worldwide",ele deseja ainda lutar pelo título mundial da Federação Internacional.,– He still wants to fight for the International Federation’s world title.,[sound:mundial.ogg],
1287,folha,"sheet (of paper), page, leaf",pegue uma folha de papel e desenhe.,–Grab a sheet of paper and draw.,[sound:folha.ogg],
1288,extraordinário,extraordinary,a criança demonstrou sua extraordinária precocidade logo após vir ao mundo.,– The child showed his extraordinary precociousness soon after coming to the world.,[sound:extraordinário.ogg],
1289,reserva,reserve,as grandes reservas de ferro e carvão encontram-se parcialmente esgotadas.,– The large reserves of iron and coal are partially exhausted.,[sound:reserva.ogg],
1290,cenário,"backdrop (theater), scenery",o local serviu de cenário para a gravação da novela.,– The place served as the backdrop for the filming of the soap opera.,[sound:cenário.ogg],
1291,mensagem,message,o papa levou sua mensagem conciliatória para líderes de outras igrejas.,– The pope took his conciliatory message to leaders of other churches.,[sound:mensagem.ogg],
1292,crescimento,growth,o seu crescimento rápido conduziu à construção das actuais instalações.,– Its rapid growth led to the construction of its current location.,[sound:crescimento.ogg],
1293,reagir,to react,"o senhor não reagiu, não fez nada.","– Sir, you didn’t react, you didn’t do anything.",[sound:reagir.ogg],
1294,constituição,constitution,há uma frase da Constituição que diz que a soberania reside no povo.,– There is a clause from the Constitution that says that sovereignty rests in the people.,[sound:constituição.ogg],
1295,explicação,explanation,foram avançadas várias explicações para a origem destas leis.,– Many explanations were advanced as to the origin of these laws.,[sound:explicação.ogg],
1296,espera,"wait, expectation","a espera, naquele silêncio, parece interminável.","– The wait, in that silence, seems interminable.",[sound:espera.ogg],
1297,votar,to vote,a idade mínima para votar baixou para 18 anos em quase todo o mundo.,– Theminimum voting age has been lowered to 18 in most of the world.,[sound:votar.ogg],
1298,perda,loss,ele sofreu perdas inesperadas de 120 milhões de dólares.,– He suffered unexpected losses in the amount of 120 million dollars.,[sound:perda.ogg],
1299,artístico,artistic,a sua formação artística incluiu um curso de escultura.,– His artistic training included a course in sculpture.,[sound:artístico.ogg],
1300,leve,"light (weight, color)",o beija-flor é um animal muito leve.,– The hummingbird is a very light animal.,[sound:leve.ogg],
1301,clima,climate,o clima da ilha é temperado com influências mediterrâneas.,– The island’s climate is temperate with Mediterranean influences.,[sound:clima.ogg],
1302,permanente,permanent,"além da coleção permanente, são continuamente promovidas exposições temporária.","– Besides the permanent collection, temporary exhibits are constantly promoted.",[sound:permanente.ogg],
1303,quilómetro,kilometer,a área afectada abrangia um total de 17 mil quilómetros quadrados na região.,"– The affected area covered a total of 17,000 square kilometers in the region.",[sound:quilómetro.ogg],pt-pt
1304,quilômetro,kilometer,a área afectada abrangia um total de 17 mil quilómetros quadrados na região.,"– The affected area covered a total of 17,000 square kilometers in the region.",[sound:quilômetro.ogg],pt-br
1305,jogador,player,cada equipa possui um jogador como guarda-redes.,– Each team has a player who acts as goalie.,[sound:jogador.ogg],
1306,troca,"exchange, switch",ele tinha um bom salário e em troca era-lhe exigida dedicação.,"– In exchange for his good salary, dedication was demanded of him.",[sound:troca.ogg],
1307,divisão,division,a divisão política existe entre o norte e o su.,– The political division exists between the north and the south.,[sound:divisão.ogg],
1308,investigação,investigation,a polícia já iniciara as investigações.,– The police had already begun investigations.,[sound:investigação.ogg],
1309,rainha,queen,todo o reino chorou pela rainha que morrera para dar um herdeiro ao trono.,– The whole kingdom cried over the queen that died to give birth to an heir to the throne.,[sound:rainha.ogg],
1310,palácio,palace,o Palácio de Buckingham está aberto ao público.,– Buckingham Palace is open to the public.,[sound:palácio.ogg],
1311,integrar,"to integrate, be part of",os países da Europa de Leste tiveram que se integrar num sistema democrático.,– The countries in Eastern Europe had to be integrated into a democratic system.,[sound:integrar.ogg],
1312,administrativo,administrative,o ministro da República superintende ainda as funções administrativas exercidas pelo Estado.,– The minister also oversees the administrative functions of the state.,[sound:administrativo.ogg],
1313,útil,"useful, helpful",imagens de satélites são úteis para monitorar uma propriedade.,– Satellite images are useful in monitoring properties.,[sound:útil.ogg],
1314,manifestar,"to manifest, express","neste momento, as divergências entre regiões manifestam-se de forma pouco democrática.","– At this moment, the regional differences are being made manifest in a very undemocratic  way.",[sound:manifestar.ogg],
1315,participação,participation,sua carreira militar inclui participação em inúmeros conflitos.,– His military career includes participation in innumerable conflicts.,[sound:participação.ogg],
1316,comportamento,"behavior, conduct",ela veio a denunciar os comportamentos reprováveis de dois deputados.,– She ended up denouncing the reproachable behavior of two congressmen.,[sound:comportamento.ogg],
1317,circunstância,circumstance,as circunstâncias da sua morte continuam a ser um mistério.,– The circumstances of his death continue to be a mystery.,[sound:circunstância.ogg],
1318,alegre,happy,"ele estava sempre alegre e satisfeito, demonstrando seu bom humor com gargalhadas.","– He was always happy and content, showing his good humor through laughter.",[sound:alegre.ogg],
1319,casal,married couple,"uma família não é apenas o casal, são também os filhos.",– A family isn’t just the married couple; it is also the children.,[sound:casal.ogg],
1320,esconder,to hide,na hora do tiroteio peguei minha filha e me escondi.,"– Right when the shooting happened, I grabbed my daughter and hid.",[sound:esconder.ogg],
1321,taxa,"rate, tax",a taxa de evaporação sobe com o aumento da temperatura.,– The rate of evaporation goes up with the increase in temperature.,[sound:taxa.ogg],
1322,inicial,initial,a diferença entre a massa final e a inicial é convertida em energia.,– The difference between the final and the initial mass is converted into energy.,[sound:inicial.ogg],
1323,príncipe,prince,"com a morte da rainha, o príncipe foi coroado rei.","– With the death of the queen, the prince was crowned king.",[sound:príncipe.ogg],
1324,universo,universe,"segundo a religião, Deus é o criador de todas as coisas no Universo.","– According to religion, God is the creator of all things in the Universe.",[sound:universo.ogg],
1325,dormir,to sleep,é melhor descansar e dormir umas oito horas por noite.,– It’s better to rest and sleep about eight hours per night.,[sound:dormir.ogg],
1326,garantia,"warranty, guarantee",ele assinou um contrato de garantia de compra.,– He signed a contract as a purchase warranty.,[sound:garantia.ogg],
1327,ave,bird,algumas aves migradoras conseguem voar vários milhares de quilómetros sobre território desconhecido.,– Some migratory birds manage to fly several thousand kilometers over unknown territory.,[sound:ave.ogg],
1328,amar,to love,o facto é que a Hortência nunca amou o marido.,– The fact is that Hortência never loved her husband.,[sound:amar.ogg],
1329,assinar,to sign,eles pediram para eu assinar um documento me responsabilizando pelo projecto.,– They asked me to sign a document in which I would take responsibility for the project.,[sound:assinar.ogg],
1330,motor,"engine, motor",os automóveis de corrida têm o motor no meio para equilibrar.,– Race cars have their engine in the middle to keep them balanced.,[sound:motor.ogg],
1331,gravar,"to record, engrave",o disco será gravado pelo meu selo.,–The record will be recorded on my label.,[sound:gravar.ogg],
1332,fé,faith,para ele a salvação era dada pela fé e não pelas obras.,"– To him, salvation was achieved by faith and not by works.",[sound:fé.ogg],
1333,expor,"to exhibit, expose",o artista expõe 13 desenhos e 20 pinturas.,– The artist is exhibiting 13 drawings and 20 paintings.,[sound:expor.ogg],
1334,dedo,finger,"se houver crise, assim ninguém me poderá apontar o dedo.","– If there is a crisis, this way nobody will be able to point their finger at me.",[sound:dedo.ogg],
1335,canção,song,Truckin’ é uma canção do Grateful Dead.,– Truckin’ is a Grateful Dead song.,[sound:canção.ogg],
1336,negativo,negative,obtivemos apenas resultados negativos quando tentamos resolver o problema.,– We obtained only negative results when we tried to solve the problem.,[sound:negativo.ogg],
1337,industrial,industrial,a Revolução Industrial veio modificar as formas de produção.,– The Industrial Revolution changed the methods of production.,[sound:industrial.ogg],
1338,posse,possession,ele decidiu então tomar posse da terra em nome da Espanha.,– He then decided to take possession of the land in the name of Spain.,[sound:posse.ogg],
1339,lucro,profit,"quando uma empresa apresenta lucros elevados, os dividendos também são altos.","– When a company has high levels of profit, dividends are also high.",[sound:lucro.ogg],
1340,expetativa,expectation,não queremos criar expectativas acima das nossas possibilidades.,– We don’t want to create expectations above our abilities.,[sound:expetativa.ogg],
1341,traduzir,to translate,falo em inglês e eles traduzem para a língua daqui.,– I speak to them in English and they translate it to their native language.,[sound:traduzir.ogg],
1342,libertar,"to free, liberate","não pude fazer nada para os libertar porque as trancas eram muito pesadas,.",– I couldn’t do anything to free them because the crossbars were so heavy.,[sound:libertar.ogg],
1343,manifestação,"demonstration, protest",os braços caíram-lhe numa espontânea manifestação de desânimo.,– His arms fell to his side in a spontaneous demonstration of despair.,[sound:manifestação.ogg],
1344,líder,leader,o problema é que os líderes políticos não querem enfrentar a questão.,– The problem is that political leaders don’t want to face up to the problem.,[sound:líder.ogg],
1345,horizonte,horizon,"no horizonte, o sol era uma lâmina em bras.","– On the horizon, the sun was a blade on fire.",[sound:horizonte.ogg],
1346,urbano,urban,"nas grandes zonas urbanas, a vida quotidiana tem um ritmo mais rápido.","–In large urban zones, everyday life is faster paced.",[sound:urbano.ogg],
1347,território,territory,"actualmente, o nosso território estende-se para além da fronteira do rio.",– Currently our territory extends beyond the river front.,[sound:território.ogg],
1348,compromisso,"commitment, appointment",o prefeito alegou que tinha um compromisso a cumprir com seu eleitorado.,– The mayor alleged that he had a commitment to his constituency which he needed to fulfill.,[sound:compromisso.ogg],
1349,feminino,"female, feminine","no sexo feminino, o tumor maligno mais frequente é o cancro de mama.","– For the female sex, the most frequent malignant tumor is breast cancer.",[sound:feminino.ogg],
1350,mover,to move,Filipe moveu os lábios num vago sorriso de indiferença.,– Filipe moved his lips in a faint smile of indifference.,[sound:mover.ogg],
1351,município,municipality,A Universidade funciona em 15 dos 77 municípios do estado.,– The University has campuses in 15 of the 77 state municipalities.,[sound:município.ogg],
1352,entidade,entity,o núcleo será composto também por entidades governamentais e nãogovernamentais.,– The core group will also be made up of governmental and non-governmental  entities.,[sound:entidade.ogg],
1353,constante,constant,o Sol está em constante rotação.,– The sun is in constant rotation.,[sound:constante.ogg],
1354,pagamento,payment,é assegurado aos credores o direito de pedir o pagamento das dívidas.,– The creditors are guaranteed the right to ask for payment of the debts owed them.,[sound:pagamento.ogg],
1355,sequer,(not) even (nem s.),"não fiquei magoada, nem sequer decepcionada.",– I didn’t get angry or even disillusioned.,[sound:sequer.ogg],
1356,promover,to promote,o principal objetivo dos prefeitos é promover o desenvolvimento turístico da região.,– The mayors’ principal objective is to promote the tourist development of the region.,[sound:promover.ogg],
1357,argumento,argument,existem diversos argumentos a favor da evolução.,– There are many arguments in favor of evolution.,[sound:argumento.ogg],
1358,controlar,to control,os diabéticos precisam controlar cuidadosamente o consumo de açúcares.,– Diabetics need to carefully control their sugar consumption.,[sound:controlar.ogg],
1359,fome,"hunger, famine",muitos aldeões passaram fome durante a ditadura.,– Many peasants suffered hunger during the dictatorship.,[sound:fome.ogg],
1360,pintor,painter,ele foi pintor de paisagens sóbrias e austera.,– He was a painter of sober and austere landscapes.,[sound:pintor.ogg],
1361,adotar,to adopt,os romanos adoptaram o sistema de educação grego.,– The Romans adopted the Greek educational system.,[sound:adotar.ogg],
1362,restar,to remain,da obra restam apenas fragmentos.,– Only fragments of the work remain.,[sound:restar.ogg],
1363,calor,"heat, warmth",seria mais um dia de sol intenso e calor.,– It was going to be another day of intense sun and heat.,[sound:calor.ogg],
1364,exceção,exception,"todos tinham cerca de 20 anos, com excepção da jovem que tinha 13.","– All of them were about twenty years old, except for the young woman, who was 13.",[sound:exceção.ogg],
1365,ausência,absence,a ausência de vitaminas na alimentação pode causar problemas.,– The absence of vitamins in one’s diet can cause problems.,[sound:ausência.ogg],
1366,externo,external,somente na tensão entre o interno e o externo a consciência pode formar-se.,– Only in the tension between the internal and external can consciousness be formed.,[sound:externo.ogg],
1367,distribuir,to distribute,os ricos vão ter que distribuir a riqueza deles com os pobres.,– The rich will have to distribute their wealth among the poor.,[sound:distribuir.ogg],
1368,método,method,"ele não concordava com os métodos de ensino, preferindo estudar por conta própri.","– He didn’t agree with their teaching methods, preferring to study on his own.",[sound:método.ogg],
1369,crítico,"critic, critical",outro problema levantado pelos críticos é a pouca presença de artistas latino-americano.,– Another problem raised by critics was the lack of a significant presence by LatinAmerican artists.,[sound:crítico.ogg],
1370,inferior,"lower, less, inferior",a troposfera localiza-se na parte inferior da atmosfera.,– The troposphere is located in the lower part of the atmosphere.,[sound:inferior.ogg],
1371,completo,complete,"as informações por ele obtidas, embora não fossem completas, eram suficientes.","– The information he obtained, although not complete, was sufficient.",[sound:completo.ogg],
1372,proteção,protection,o meu país e outros buscavam proteção contra uma possível desvalorização cambia.,– My country and others sought protection against a possible monetary devaluation.,[sound:proteção.ogg],
1373,excelente,excellent,este conjunto de adaptações dá à ave excelente equilíbrio.,– This combination of adaptations gives the bird excellent balance.,[sound:excelente.ogg],
1374,calcular,"to calculate, reckon","a perda foi total, embora ele não soubesse calcular o valor do prejuízo.","– It was a complete loss, even though he didn’t know how to calculate the cost of the damages.",[sound:calcular.ogg],
1375,demorar,"to take (time), delay",quanto tempo é que se demora para chegar daqui a Viana?,– How much time does it take to get to Viana from here?,[sound:demorar.ogg],
1376,sentar,to sit,todos os jogadores se podem sentar no banco.,– All players may sit on the bench.,[sound:sentar.ogg],
1377,interpretar,"to interpret, act (e.g. movie)",não existe uma fórmula básica para interpretar a arte.,– There is no basic formula for interpreting art.,[sound:interpretar.ogg],
1378,sorte,"luck, lot",algumas tinham mais sorte: as que haviam conseguido realizar os seus sonhos.,– Some had better luck: those who were able to achieve their dreams.,[sound:sorte.ogg],
1379,secretaria,office,a secretaria do liceu tinha perdido os registos académicos da aluna.,– The main office of the high school had lost academic records of the female student.,[sound:secretaria.ogg],
1380,recolher,"to collect, put away, remove","esse dinheiro será recolhido pela União, na forma de pagamento de impostos.","– That money will be collected by the Union, in the form of tax payments.",[sound:recolher.ogg],
1381,deter,"to arrest, detain",a polícia federal deteve o assassino e entregou-o ao sistema prisional.,– The federal police arrested the murderer and turned him in to the prison system.,[sound:deter.ogg],
1382,ceder,"to give in, yield",eu a julgava incapaz de ceder sem resistência às passageiras solicitações.,–I imagined she would be incapable of giving in so easily to unimportant requests.,[sound:ceder.ogg],
1383,feliz,happy,desejamos aos leitores boas festas e feliz ano novo.,– We wish our readers happy holidays and a happy New Year.,[sound:feliz.ogg],
1384,cadeira,"chair, college course","encontrando-o só, ele puxou uma cadeira e sentou-se.","– Finding him alone, he pulled out a chair and sat down.",[sound:cadeira.ogg],
1385,comunista,communist,"o primeiro país comunista foi a URSS, depois da Revolução de 1917.","– The first communist country was the USSR, after the Revolution of 1917.",[sound:comunista.ogg],
1386,emoção,emotion,ele lia tudo com emoção e fé.,– He read it all with emotion and faith.,[sound:emoção.ogg],
1387,representante,representative,Van Gogh é o grande representante doPós-Impressionismo.,– Van Gogh is the great representative of Post-Impressionism.,[sound:representante.ogg],
1388,ultrapassar,"to overcome, surpass, pass (car)",Eles conseguiram ultrapassar os problema.,– They were able to overcome their problems.,[sound:ultrapassar.ogg],
1389,comando,command,"os prussianos, sob o comando do conde, avançavam em direcção ao norte.","– The Prussians, under the command of the count, advanced heading north.",[sound:comando.ogg],
1390,alvo,"target, aim, white as snow",o alvo principal de sua crítica demolidora é a hipocrisia da sociedade.,– The main target  of his sharp criticism is society’s hypocrisy.,[sound:alvo.ogg],
1391,concentrar,to concentrate,o prefeito deve concentrar esforços em do is projetos específicos.,– The mayor should concentrate his efforts on two specific projects.,[sound:concentrar.ogg],
1392,comunicar,"to convey, communicate",com nenhuma palavra eu lhe poderia comunicar o meu sonho.,– There are not words with which to convey my dream to you.,[sound:comunicar.ogg],
1393,coletivo,"collective, public transportation [BP]","o jornalismo é hoje uma instituição coletiva, anônima e quase irresponsável.",– Journalism today is an anonymous and nearly irresponsible collective institution.,[sound:coletivo.ogg],
1394,jeito,"way, manner",tenho que arranjar um jeito de sair daqu.,– I have to find some way to get out of here.,[sound:jeito.ogg],
1395,atuar,"to perform, act",na festa actuou o grupo de rock algarvio.,"– At the party, the group of Algarve rock performed.",[sound:atuar.ogg],
1396,janela,window,pela janela aberta o vento frio invadia o quarto.,– The cold wind rushed into the room through the open window.,[sound:janela.ogg],
1397,certamente,certainly,escrever uma carta certamente é uma ação social.,– Letter writing is certainly a social action.,[sound:certamente.ogg],
